notice_id,solicitation_number,title,notice_type,posted_date,response_deadline,archive_date,agency,subagency,office,naics,psc,set_aside,set_aside_code,place_of_performance_state,source_url,pull_timestamp_utc
29d94ab494514c96bf2500d8e7e731ca,SEA04N,RADIAC AND RADCON PROGRAM PROFESSIONAL SUPPORT SERVICES,Sources Sought,2026-06-30,2026-07-15,2027-06-30,DEPT OF DEFENSE,DEPT OF THE NAVY,NAVAL SURFACE WARFARE CENTER,541330,R425,,,,https://sam.gov/workspace/contract/opp/29d94ab494514c96bf2500d8e7e731ca/view,2026-07-15T12:31:17.044134+00:00
27f66197c71340fcb0ed7f7fd4d7b52d,FA481926R0003,EOD SUPPORT SERVICES TYNDALL AFB,Solicitation,2026-06-30,2026-07-21,2027-06-30,DEPT OF DEFENSE,DEPT OF THE AIR FORCE,FA4819  325 CONS PKP,541330,R499,Total Small Business Set-Aside (FAR 19.5),SBA,,https://sam.gov/workspace/contract/opp/27f66197c71340fcb0ed7f7fd4d7b52d/view,2026-07-15T12:31:17.044134+00:00
e1c8be74d82d417bb124bad9c5e5e80d,N6133126R3106,LEGACY LANDING CRAFT AIR CUSHION (LCAC) AND LCAC100 CLASS MAINTENANCE AND REPAIR SUPPORT,Solicitation,2026-06-26,2026-07-31,2026-08-31,DEPT OF DEFENSE,DEPT OF THE NAVY,NAVAL SURFACE WARFARE CENTER,541330,J020,,,,https://sam.gov/workspace/contract/opp/e1c8be74d82d417bb124bad9c5e5e80d/view,2026-07-15T12:31:17.044134+00:00
736eb5450fad4c52b3f9e7eb67ebfe3d,N0003026R3007,2027 FACILITIES ACQUISITION & ENGINEERING (FA&E) SUPPORT SERVICES,Presolicitation,2026-06-25,2026-07-10,2026-07-25,DEPT OF DEFENSE,DEPT OF THE NAVY,PAE STRATEGIC SYSTEMS PROGRAMS,541330,AC24,No Set aside used,NONE,DC,https://sam.gov/workspace/contract/opp/736eb5450fad4c52b3f9e7eb67ebfe3d/view,2026-07-15T12:31:17.044134+00:00
6d3a590e318043a29713de8304ede1de,N0003026R3001,2027 SYSTEMS ENGINEERING & INTEGRATION SUPPORT SERVICES,Presolicitation,2026-06-25,2026-07-10,2026-07-25,DEPT OF DEFENSE,DEPT OF THE NAVY,PAE STRATEGIC SYSTEMS PROGRAMS,541330,L099,,,,https://sam.gov/workspace/contract/opp/6d3a590e318043a29713de8304ede1de/view,2026-07-15T12:31:17.044134+00:00
ac02c8a474854145bcb6e26d5ff89289,FA481926R0003,EOD SUPPORT SERVICES TYNDALL AFB - RFI,Solicitation,2026-06-23,2026-07-21,2027-06-23,DEPT OF DEFENSE,DEPT OF THE AIR FORCE,FA4819  325 CONS PKP,541330,R499,Total Small Business Set-Aside (FAR 19.5),SBA,,https://sam.gov/workspace/contract/opp/ac02c8a474854145bcb6e26d5ff89289/view,2026-07-15T12:31:17.044134+00:00
49ca8b1859c74fe28a4e9d3ae1c83d68,HS0021-26-CSO-DCSA,DCSA INNOVATION GATEWAY,Solicitation,2026-06-23,2031-06-22,2031-06-22,DEPT OF DEFENSE,DEFENSE COUNTERINTELLIGENCE AND SECURITY AGENCY (DCSA),DEFENSE CI AND SECURITY AGENCY,541512,DA01,No Set aside used,NONE,VA,https://sam.gov/workspace/contract/opp/49ca8b1859c74fe28a4e9d3ae1c83d68/view,2026-07-15T12:31:17.044134+00:00
a25f01263d0e4c48a5e246f9db305e24,W911QY-26-Q-A009,DEVCOM INVENTORY SOFTWARE MANAGEMENT,Solicitation,2026-06-22,2026-06-29,2026-07-14,DEPT OF DEFENSE,DEPT OF THE ARMY,W6QK ACC-APG NATICK,541511,7A20,,,MA,https://sam.gov/workspace/contract/opp/a25f01263d0e4c48a5e246f9db305e24/view,2026-07-15T12:31:17.044134+00:00
2e0cfd3252cd442b90899bcd93133b02,N6247326R3101,CASU TECHNICAL AND PROGRAM SUPPORT SERVICES FOR THE BASE REALIGNMENT AND CLOSURE PROGRAM MANAGEMENT OFFICE (BRAC PMO),Combined Synopsis/Solicitation,2026-06-17,2026-06-22,2026-10-01,DEPT OF DEFENSE,DEPT OF THE NAVY,NAVFACSYSCOM SOUTHWEST,541330,R425,,,,https://sam.gov/workspace/contract/opp/2e0cfd3252cd442b90899bcd93133b02/view,2026-07-15T12:31:17.044134+00:00
1ca7bebef60a4579a3ee2aa5fd9e01b6,W9124J-27-R-ENTR,ENTERPRISE IT SUPPORT,Sources Sought,2026-06-17,2026-07-16,2026-07-31,DEPT OF DEFENSE,DEPT OF THE ARMY,W6QM MICC-FDO FT SAM HOUSTON,541513,DF01,Total Small Business Set-Aside (FAR 19.5),SBA,TX,https://sam.gov/workspace/contract/opp/1ca7bebef60a4579a3ee2aa5fd9e01b6/view,2026-07-15T12:31:17.044134+00:00
f52e0d4e1ab340ba80885770a036e5a0,W56ZLW-26-P-0013,DIGITAL FIRES SYSTEMS ENGINEERING SERVICES,Award Notice,2026-06-16,,2026-06-30,DEPT OF DEFENSE,DEPT OF THE ARMY,0418 AQ HQ     CONTRACTING SUP,541330,R425,Service-Disabled Veteran-Owned Small Business Set Aside,SDVOSBC,TX,https://sam.gov/workspace/contract/opp/f52e0d4e1ab340ba80885770a036e5a0/view,2026-07-15T12:31:17.044134+00:00
7c40cf1e85dc431a84764f1b686f34f1,N00244-26-R-3016,CNAP FLAG SUPPORT SERVICES,Solicitation,2026-06-12,2026-06-16,2026-07-01,DEPT OF DEFENSE,DEPT OF THE NAVY,NAVSUP FLT LOG CTR  SAN DIEGO,541330,R408,Women-Owned Small Business,WOSB,CA,https://sam.gov/workspace/contract/opp/7c40cf1e85dc431a84764f1b686f34f1/view,2026-07-15T12:31:17.044134+00:00
ad18a4f7b7394950a24769550b47ca6e,N0018926QL179,NH-139 VTC UPGRADE,Combined Synopsis/Solicitation,2026-06-11,2026-06-15,2026-12-03,DEPT OF DEFENSE,DEPT OF THE NAVY,NAVSUP FLT LOG CTR NORFOLK,541519,5836,,,VA,https://sam.gov/workspace/contract/opp/ad18a4f7b7394950a24769550b47ca6e/view,2026-07-15T12:31:17.044134+00:00
380c7631691648208091ffc9adbcb127,N0017826Q6793,ACOUSTIC TILES PROFESSIONAL SERVICES,Combined Synopsis/Solicitation,2026-06-08,2026-06-18,2026-11-01,DEPT OF DEFENSE,DEPT OF THE NAVY,NSWC DAHLGREN,541330,5640,,,VA,https://sam.gov/workspace/contract/opp/380c7631691648208091ffc9adbcb127/view,2026-07-15T12:31:17.044134+00:00
70699db185d2474e8087f681e8374748,N0017827R3105,N0017827R3105 AI_INTELLIGENT AUTOMATION SUPPORT SERVICES,Sources Sought,2026-06-08,2026-07-09,2026-07-24,DEPT OF DEFENSE,DEPT OF THE NAVY,NSWC DAHLGREN,541330,AC13,,,VA,https://sam.gov/workspace/contract/opp/70699db185d2474e8087f681e8374748/view,2026-07-15T12:31:17.044134+00:00
fd1a9e1f16c044b7b5331b7a3c0ae680,FA875126F0024,NVIDIA DGX H200 Systems,Award Notice,2026-06-05,,2026-07-05,DEPT OF DEFENSE,DEPT OF THE AIR FORCE,FA8751  AFRL RIKO,541519,7B22,,,,https://sam.gov/workspace/contract/opp/fd1a9e1f16c044b7b5331b7a3c0ae680/view,2026-07-15T12:31:17.044134+00:00
9c04cd53814f4dc092b3b3a82346d086,,"FY28 FIRE CONTROL STRATEGIC SYSTEMS PROGRAMS (SSP) DEVELOPMENT, SUSTAINMENT, PRODUCTION AND OPERATIONS SUPPORT",Special Notice,2026-05-27,2026-07-12,2026-07-27,DEPT OF DEFENSE,DEPT OF THE NAVY,PAE STRATEGIC SYSTEMS PROGRAMS,541330,1230,No Set aside used,NONE,MA,https://sam.gov/workspace/contract/opp/9c04cd53814f4dc092b3b3a82346d086/view,2026-07-15T12:31:17.044134+00:00
840504c9cd8d4dc89e6a1bbb06484f10,N523626QE187,KEYSIGHT,Presolicitation,2026-05-27,2026-06-08,2027-05-27,DEPT OF DEFENSE,DEPT OF THE NAVY,NIWC ATLANTIC,541519,7A21,,,,https://sam.gov/workspace/contract/opp/840504c9cd8d4dc89e6a1bbb06484f10/view,2026-07-15T12:31:17.044134+00:00
b1e1d540c3e84bfc97f7caeb43b015df,M67004-26-R-0003,MARINE FORCE SUSTAINMENT COMMAND AND FLEET MARINE- MULTIPLE AWARD INDEFINITE DELIVERY INDEFINITE QUANTITY CONTRACTFORCE LOGISTICS SERVICES SUPPORT-,Sources Sought,2026-05-01,2026-06-15,2026-06-30,DEPT OF DEFENSE,DEPT OF THE NAVY,COMMANDER,541330,R706,Total Small Business Set-Aside (FAR 19.5),SBA,GA,https://sam.gov/workspace/contract/opp/b1e1d540c3e84bfc97f7caeb43b015df/view,2026-07-15T12:31:17.044134+00:00
5d5105ccca694a2a84b4242c84d3cce1,N0003926RE013,NILE IN SERVICE SUPPORT (ISS) 6 ENGINEERING SERVICES RFI,Sources Sought,2026-01-29,2026-03-04,2027-01-29,DEPT OF DEFENSE,DEPT OF THE NAVY,NAVAL INFORMATION WARFARE SYSTEMS,541512,DA01,,,,https://sam.gov/workspace/contract/opp/5d5105ccca694a2a84b4242c84d3cce1/view,2026-07-15T12:31:17.044134+00:00
e8bc16355f0947ea87b680b77a2a0c2d,N6523626R3100,MYNAVYHR IT SOLUTIONS MANPOWER AND PERSONNEL SYSTEMS,Solicitation,2026-01-26,2026-02-20,2026-03-07,DEPT OF DEFENSE,DEPT OF THE NAVY,NIWC ATLANTIC,541330,R425,Total Small Business Set-Aside (FAR 19.5),SBA,LA,https://sam.gov/workspace/contract/opp/e8bc16355f0947ea87b680b77a2a0c2d/view,2026-07-15T12:31:17.044134+00:00
b065ca383e0d4254aeae51c780a17b81,M67854-26-I-5101,CONDITION BASED MAINTENANCE PLUS (CBM+),Sources Sought,2026-01-15,2025-12-29,2028-12-31,DEPT OF DEFENSE,DEPT OF THE NAVY,COMMANDER,541512,7H20,No Set aside used,NONE,VA,https://sam.gov/workspace/contract/opp/b065ca383e0d4254aeae51c780a17b81/view,2026-07-15T12:31:17.044134+00:00
404892a314c948ca9be34d756bc5616d,N65236_26_GEO_JOBE_SOFTWARE,GEO JOBE SOFTWARE,Presolicitation,2026-01-12,2026-01-12,2027-01-12,DEPT OF DEFENSE,DEPT OF THE NAVY,NIWC ATLANTIC,541519,7A21,,,,https://sam.gov/workspace/contract/opp/404892a314c948ca9be34d756bc5616d/view,2026-07-15T12:31:17.044134+00:00
46e7aa4de79d4cd391f8309f5e7f7876,N00167-26-AST,ADVANCED SIGNATURES TECHNOLOGIES (AST) SUPPORT SERVICES,Sources Sought,2026-01-09,2026-02-09,2027-01-09,DEPT OF DEFENSE,DEPT OF THE NAVY,NSWC CARDEROCK,541330,,,,,https://sam.gov/workspace/contract/opp/46e7aa4de79d4cd391f8309f5e7f7876/view,2026-07-15T12:31:17.044134+00:00
b3c6af6e7fae4e0a84df6110d87aa7a5,W912BU26RA001,"INDEFINITE DELIVERY INDEFINITE QUANTITY CONTRACT FOR DREDGE VESSEL ENGINEERING SERVICES, NAVAL ARCHITECTURE, AND MARINE ENGINEERING",Combined Synopsis/Solicitation,2025-10-01,2025-10-03,2026-10-03,DEPT OF DEFENSE,DEPT OF THE ARMY,W2SD ENDIST PHILADELPHIA,541330,C216,Total Small Business Set-Aside (FAR 19.5),SBA,,https://sam.gov/workspace/contract/opp/b3c6af6e7fae4e0a84df6110d87aa7a5/view,2026-07-15T12:31:17.044134+00:00
f27d911fea014bc1b431494c7bc13e67,N6523625FE047,N6523625FE047 DC2HS AWS IL6 SUPPORT,Award Notice,2025-07-09,,2026-07-09,DEPT OF DEFENSE,DEPT OF THE NAVY,NIWC ATLANTIC,518210,DB10,,,,https://sam.gov/workspace/contract/opp/f27d911fea014bc1b431494c7bc13e67/view,2026-07-15T12:31:17.044134+00:00
d93b297d3103478ba4f7c79969855733,W519TC-25-R-ADP2,PEO EIS ARDAP ARMY DATA PLATFORM 2.0 RFI,Presolicitation,2024-09-26,2024-10-16,2026-10-16,DEPT OF DEFENSE,DEPT OF THE ARMY,W6QK ACC-RI,541512,DA01,,,VA,https://sam.gov/workspace/contract/opp/d93b297d3103478ba4f7c79969855733/view,2026-07-15T12:31:17.044134+00:00
7d4232528fcd23456265805d03bcaf09,HQ0034-19-R-0217,OFFICE OF GENERAL COUNSEL ELECTRONICALLY-STORED INFORMATION AND EDISCOVERY SOLUTION,Sources Sought,2019-06-21,2019-07-19,2019-07-20,DEPT OF DEFENSE,WASHINGTON HEADQUARTERS SERVICES (WHS),WASHINGTON HEADQUARTERS SERVICES,518210,D,,,VA,https://sam.gov/workspace/contract/opp/7d4232528fcd23456265805d03bcaf09/view,2026-07-15T12:31:17.044134+00:00
945f9340ad4cf62f33ba2c1f84cf9e73,N62793-18-R-0058,IT SUPPORT SERVICES,Modification/Amendment/Cancel,2018-08-17,2018-08-20,2018-09-04,DEPT OF DEFENSE,DEPT OF THE NAVY,SUP OF SHIPBUILDING CONV AND REPAIR,541519,D,Total Small Business Set-Aside (FAR 19.5),SBA,VA,https://sam.gov/workspace/contract/opp/945f9340ad4cf62f33ba2c1f84cf9e73/view,2026-07-15T12:31:17.044134+00:00
4183571568f9478459c0a9449f984b24,N00421-16-R-0021,"4.11.5 (ETMS) ENGINEERING, TECHNICAL, AND MANAGEMENT SERVICES",Sources Sought,2017-04-06,2017-04-21,2017-05-06,DEPT OF DEFENSE,DEPT OF THE NAVY,NAVAL AIR WARFARE CENTER AIR DIV,541330,R,Total Small Business Set-Aside (FAR 19.5),SBA,MD,https://sam.gov/workspace/contract/opp/4183571568f9478459c0a9449f984b24/view,2026-07-15T12:31:17.044134+00:00
cb69b87db3563a9e7e21390c317e2b38,N0040617T0187,D--DELL SOLID STATE DISK ACCESSORIES AND SUPPORT,Solicitation,2017-01-14,,,DEPT OF DEFENSE,DEPT OF THE NAVY,NAVSUP FLT LOG CTR PUGET SOUND,541519,D,,,,https://sam.gov/workspace/contract/opp/cb69b87db3563a9e7e21390c317e2b38/view,2026-07-15T12:31:17.044134+00:00
b43cf162e742158b5ca8f2e11db92d7c,W912NW-16-T-0014,VBRICK HARDWARE/SOFTWARE SUPPORT,Modification/Amendment/Cancel,2016-01-12,2016-02-10,2016-02-25,DEPT OF DEFENSE,DEPT OF THE ARMY,W6QK CCAD CONTR OFF,541511,70,,,TX,https://sam.gov/workspace/contract/opp/b43cf162e742158b5ca8f2e11db92d7c/view,2026-07-15T12:31:17.044134+00:00
1f84c6cfa059283b0badb1ba1ffc84ed,FA5209-09-T-0130,IT PROJECT MANAGEMENT & IT SYSTEMS ANALYSIS SUPPORT FOR THE 374th COMMUNICATIONS SQUADRON�S PLANS & RESOURCES FLIGHT AT YOKOTA AB JAPAN,Modification/Amendment/Cancel,2009-09-28,2009-10-13,2009-10-28,DEPT OF DEFENSE,DEPT OF THE AIR FORCE,FA5209  374 CONS PK,541519,D,,,,https://sam.gov/workspace/contract/opp/1f84c6cfa059283b0badb1ba1ffc84ed/view,2026-07-15T12:31:17.044134+00:00
7195a44fef074c6181da117dbff30887,W912DY26RA007,Request for Proposal - Fort Rucker II - W912DY26RA007,Solicitation,2026-04-17,2026-05-17,2027-04-17,DEPT OF DEFENSE,DEPT OF THE ARMY,W2V6 USA ENG SPT CTR HUNTSVIL,541330,R425,,,,https://sam.gov/workspace/contract/opp/7195a44fef074c6181da117dbff30887/view,2026-07-15T12:31:17.044134+00:00
e61e9b5123894e1ea68101ed80994db5,SW023226,Architecture and Engineering (A-E) Services - Enterprise Solution (Southwest Region),Special Notice,2025-06-11,2025-07-14,2026-06-11,DEPT OF DEFENSE,DEPT OF THE ARMY,W6QM MICC-FT CAMPBELL,541330,C1QA,Total Small Business Set-Aside (FAR 19.5),SBA,,https://sam.gov/workspace/contract/opp/e61e9b5123894e1ea68101ed80994db5/view,2026-07-15T12:31:17.044134+00:00
db8e8d467287458b8db6f057ab5545b0,N0017326Q5612-1,NOTICE OF CANCELLATION - N0017326Q5612,Special Notice,2026-06-18,2026-06-24,2026-07-09,DEPT OF DEFENSE,DEPT OF THE NAVY,NAVAL RESEARCH LABORATORY,541519,7A21,No Set aside used,NONE,CA,https://sam.gov/workspace/contract/opp/db8e8d467287458b8db6f057ab5545b0/view,2026-07-15T12:31:17.044134+00:00
1aa6d0ac5b384ec6a93ef02aa89706b2,W15P7T-26-R-A006,Marketplace for Acquisition of Professional Services (MAPS),Solicitation,2026-04-22,2026-05-01,2028-05-01,DEPT OF DEFENSE,DEPT OF THE ARMY,W6QK ACC-APG,541330,R425,,,MD,https://sam.gov/workspace/contract/opp/1aa6d0ac5b384ec6a93ef02aa89706b2/view,2026-07-15T12:31:17.044134+00:00
a4263c50b54d475085f6f609800c4ea4,W900KK-26-ST3-Professional-Services,CPE ST3 Professional Services,Presolicitation,2026-04-27,2026-04-13,2026-04-28,DEPT OF DEFENSE,DEPT OF THE ARMY,W6QK ACC-ORLANDO,541330,R499,,,FL,https://sam.gov/workspace/contract/opp/a4263c50b54d475085f6f609800c4ea4/view,2026-07-15T12:31:17.044134+00:00
49946ae50c244b23987de83a5fd9a05d,N0018926FGENFOLON,FGEN Support Services,Sources Sought,2026-06-17,2026-06-29,2026-07-14,DEPT OF DEFENSE,DEPT OF THE NAVY,NAVSUP FLT LOG CTR NORFOLK,541330,,,,VA,https://sam.gov/workspace/contract/opp/49946ae50c244b23987de83a5fd9a05d/view,2026-07-15T12:31:17.044134+00:00
fa4f57118d074b2eb4f4e6fb35c5481f,N0024426R3108,SeaPort CNSP - Readiness Assistance Training Team (RATT) Support,Presolicitation,2026-06-09,2026-06-15,2026-06-30,DEPT OF DEFENSE,DEPT OF THE NAVY,NAVSUP FLT LOG CTR  SAN DIEGO,541330,R425,Service-Disabled Veteran-Owned Small Business Set Aside,SDVOSBC,CA,https://sam.gov/workspace/contract/opp/fa4f57118d074b2eb4f4e6fb35c5481f/view,2026-07-15T12:31:17.044134+00:00
d697dfca813e4f4698511429f3d446a8,N6134025R0062,N6134025R0062 SOURCES SOUGHT: Aviation Distributed Virtual Training Environment (ADVTE) III and Tactical Environment (Ten) Subsystem - USMC,Sources Sought,2025-07-07,2025-07-29,2026-07-29,DEPT OF DEFENSE,DEPT OF THE NAVY,NAWC TRAINING SYSTEMS DIV,541512,7B22,,,FL,https://sam.gov/workspace/contract/opp/d697dfca813e4f4698511429f3d446a8/view,2026-07-15T12:31:17.044134+00:00
cd75a785cfee4c5e87dedcd21ee0ac7f,TRANSCOM25CSO001,CSO - USTRANSCOM Information Technology (IT) Enterprise Modernization (ITEM) Solutions,Presolicitation,2025-08-04,2030-08-04,2030-08-04,DEPT OF DEFENSE,US TRANSPORTATION COMMAND (USTRANSCOM),USTRANSCOM-AQ,541519,DD01,No Set aside used,NONE,IL,https://sam.gov/workspace/contract/opp/cd75a785cfee4c5e87dedcd21ee0ac7f/view,2026-07-15T12:31:17.044134+00:00
8a285b81110c401e91c069c2d4a68523,W912CH-26-C-0014,THOR IV STS - Award,Award Notice,2026-06-25,,2026-07-10,DEPT OF DEFENSE,DEPT OF THE ARMY,W6QK ACC- DTA,541330,K010,,,MI,https://sam.gov/workspace/contract/opp/8a285b81110c401e91c069c2d4a68523/view,2026-07-15T12:31:17.044134+00:00
456b019a0b63414aa3015c347a8ed82c,FA8771-26-S-C0001,Department of the Air Force Program Business and Enterprise Systems (BES) Commercial Solutions Opening (CSO),Presolicitation,2026-05-05,,2036-01-01,DEPT OF DEFENSE,DEPT OF THE AIR FORCE,FA8771  AFLCMC GBK,541519,DA01,No Set aside used,NONE,AL,https://sam.gov/workspace/contract/opp/456b019a0b63414aa3015c347a8ed82c/view,2026-07-15T12:31:17.044134+00:00
805e24d9fb204c5691eb0c8ce72356b5,N6893626R0010,Sea Range Safety Surveillance Services,Sources Sought,2026-02-12,2026-03-04,2027-02-12,DEPT OF DEFENSE,DEPT OF THE NAVY,NAVAL AIR WARFARE CENTER,541330,AC33,,,,https://sam.gov/workspace/contract/opp/805e24d9fb204c5691eb0c8ce72356b5/view,2026-07-15T12:31:17.044134+00:00
f90c9f7bfc0e4a22918be32218390285,FA469026Q0026,Ellsworth Junos Training,Solicitation,2026-06-23,2026-06-25,2026-07-10,DEPT OF DEFENSE,DEPT OF THE AIR FORCE,FA4690  28 CONS PKC,541519,U012,Total Small Business Set-Aside (FAR 19.5),SBA,SD,https://sam.gov/workspace/contract/opp/f90c9f7bfc0e4a22918be32218390285/view,2026-07-15T12:31:17.044134+00:00
382c24375f2a4f4781acf20e7d7bc8b1,N6449826R3102,"Engineering, Technical, and Programmatic Services Supporting the NSWCPD Machinery Research and Silencing Division C/32 (SeaPort-NxG)",Solicitation,2026-05-04,2026-06-05,2027-05-04,DEPT OF DEFENSE,DEPT OF THE NAVY,NSWC PHILADELPHIA DIV,541330,R425,,,,https://sam.gov/workspace/contract/opp/382c24375f2a4f4781acf20e7d7bc8b1/view,2026-07-15T12:31:17.044134+00:00
e3fceace658a4f22baf730d101707c4f,N6247026R0009,"INDEFINITE DELIVERY/INDEFINITE QUANTITY CONTRACT FOR ARCHITECT-ENGINEER SERVICES FOR GEOTECHNICAL ENGINEERING SERVICES AT VARIOUS ACTIVITIES LOCATED WITHIN THE NAVAL FACILITIES ENGINEERING SYSTEM COMMAND ATLANTIC (NAVFAC ATLANTIC) AREA OF RESPONSIBILITY,",Combined Synopsis/Solicitation,2026-01-21,2026-01-30,2026-12-22,DEPT OF DEFENSE,DEPT OF THE NAVY,NAVFACSYSCOM ATLANTIC,541330,C211,,,,https://sam.gov/workspace/contract/opp/e3fceace658a4f22baf730d101707c4f/view,2026-07-15T12:31:17.044134+00:00
76f3e8905d6f4809af7baad59e825aaf,N6893625F5139,Cisco,Justification,2025-09-10,,2026-09-09,DEPT OF DEFENSE,DEPT OF THE NAVY,NAVAL AIR WARFARE CENTER,541519,7G21,,,,https://sam.gov/workspace/contract/opp/76f3e8905d6f4809af7baad59e825aaf/view,2026-07-15T12:31:17.044134+00:00
72db408c20c24775a3547b7b734c1feb,N0042126R3006,NAWCAD WOLF SAIW Technical and Engineering Services (TES),Solicitation,2026-06-22,2026-07-02,2027-06-22,DEPT OF DEFENSE,DEPT OF THE NAVY,NAVAL AIR WARFARE CENTER AIR DIV,541330,AC13,,,,https://sam.gov/workspace/contract/opp/72db408c20c24775a3547b7b734c1feb/view,2026-07-15T12:31:17.044134+00:00
16aa1378c8744a27a3d76e12b961dd25,W912HV-25-Z-0014,"Indefinite Delivery Contracts for Architect-Engineer Services to Support Host Nation projects, various locations, Japan",Sources Sought,2025-08-12,2025-09-15,2025-10-15,DEPT OF DEFENSE,DEPT OF THE ARMY,W2SN ENDIST JAPAN,541330,C211,,,,https://sam.gov/workspace/contract/opp/16aa1378c8744a27a3d76e12b961dd25/view,2026-07-15T12:31:17.044134+00:00
71e1c294a5c3919d2578f0145a43b2cc,N0018917TECSR,U--Industry Day Q and A/contact info,Special Notice,2017-07-31,,,DEPT OF DEFENSE,DEPT OF THE NAVY,NAVSUP FLT LOG CTR NORFOLK,541330,U,,,,https://sam.gov/workspace/contract/opp/71e1c294a5c3919d2578f0145a43b2cc/view,2026-07-15T12:31:17.044134+00:00
36b3fb62dd3f40e893f0bf748cf51cc5,N6134026R0008,Fielded Training Systems Support V (FTSS V) Submarine Contractor Maintenance Services (SubCMS),Solicitation,2026-01-21,2026-01-30,2027-01-21,DEPT OF DEFENSE,DEPT OF THE NAVY,NAWC TRAINING SYSTEMS DIV,541330,J069,,,,https://sam.gov/workspace/contract/opp/36b3fb62dd3f40e893f0bf748cf51cc5/view,2026-07-15T12:31:17.044134+00:00
a8dd42035be74b4fb11c1f95b8ccae2b,N0018926RB003Rev0001,"Re-issuance of canceled solicitation N0018926RB003, DUSN(M) ITD IT Related Services",Solicitation,2026-05-27,2026-06-11,2026-06-26,DEPT OF DEFENSE,DEPT OF THE NAVY,NAVSUP FLT LOG CTR NORFOLK,541330,DC01,No Set aside used,NONE,DC,https://sam.gov/workspace/contract/opp/a8dd42035be74b4fb11c1f95b8ccae2b/view,2026-07-15T12:31:17.044134+00:00
651c4689c9c64190aa9f749517baae11,W912DR26RA036,"Sources Sought Notice for Master Planning Architect-Engineer Multiple Award Task Order Contracts for the US Army Corps of Engineers, Baltimore District",Sources Sought,2026-03-12,2026-04-06,2027-03-04,DEPT OF DEFENSE,DEPT OF THE ARMY,W2SD ENDIST BALTIMORE,541330,C219,,,,https://sam.gov/workspace/contract/opp/651c4689c9c64190aa9f749517baae11/view,2026-07-15T12:31:17.044134+00:00
2d41a6ba17ff49ffa20045af336bbd28,FA7037-21-S-C001,AIR FORCE CRYPTOLOGIC OFFICE COMMERCIAL SOLUTIONS OPENING,Special Notice,2023-12-01,2024-09-30,2024-10-01,DEPT OF DEFENSE,,DEPT OF DEFENSE,541330,AC13,,,TX,https://sam.gov/workspace/contract/opp/2d41a6ba17ff49ffa20045af336bbd28/view,2026-07-15T12:31:17.044134+00:00
a4be099cde2b4db6ac1460898c9d3f06,81214,SOLE SOURCE- NEXT-GEN OPIR POLAR SOFTWARE DEPOT ACTIVATION GAP ANALYSIS,Solicitation,2026-06-12,2026-07-13,2026-07-28,DEPT OF DEFENSE,DEPT OF THE AIR FORCE,FA8571  MAINT CONTRACTING AFSC PZIM,541330,R425,,,GA,https://sam.gov/workspace/contract/opp/a4be099cde2b4db6ac1460898c9d3f06/view,2026-07-15T12:31:17.044134+00:00
9b1f6dc33aa34f798e558e188b4f6560,W15P7T-26-R-A006,Marketplace for Acquisition of Professional Services (MAPS),Solicitation,2026-05-27,2026-06-22,2028-05-01,DEPT OF DEFENSE,DEPT OF THE ARMY,W6QK ACC-APG,541330,R425,,,MD,https://sam.gov/workspace/contract/opp/9b1f6dc33aa34f798e558e188b4f6560/view,2026-07-15T12:31:17.044134+00:00
f7af84b4f3834961b1812b5156e2082b,N0003926RE011,Area of Interest (AOI): Enterprise Scheduling Tool Replacement for Project Online Retirement under CSO N0003925S0001,Solicitation,2026-03-30,2026-04-30,2027-03-30,DEPT OF DEFENSE,DEPT OF THE NAVY,NAVAL INFORMATION WARFARE SYSTEMS,541519,7A21,,,,https://sam.gov/workspace/contract/opp/f7af84b4f3834961b1812b5156e2082b/view,2026-07-15T12:31:17.044134+00:00
463638b6ad474dc79979bb928243cae5,N66001-26-Q-6101,N66001-26-Q-6101 - Notice of Intent to Award Sole Source to THE GORDIAN GROUP INC.,Special Notice,2026-03-24,2026-03-30,2027-03-25,DEPT OF DEFENSE,DEPT OF THE NAVY,NIWC PACIFIC,541519,7A21,,,,https://sam.gov/workspace/contract/opp/463638b6ad474dc79979bb928243cae5/view,2026-07-15T12:31:17.044134+00:00
ce7c49fa81af4f86bebc903ed76fb004,W912DR26RA011,Civil Works Multi-Discipline Architect/Engineer (A/E) Multiple Award Task Order Contract (MATOC),Presolicitation,2025-12-03,2025-12-20,2026-12-03,DEPT OF DEFENSE,DEPT OF THE ARMY,W2SD ENDIST BALTIMORE,541330,C219,Total Small Business Set-Aside (FAR 19.5),SBA,,https://sam.gov/workspace/contract/opp/ce7c49fa81af4f86bebc903ed76fb004/view,2026-07-15T12:31:17.044134+00:00
72c2896d9723492092adfb78393a010f,FA8207-26-R-B001,Little Mountain Test Facility Maintenance,Solicitation,2026-05-26,2026-09-08,2026-09-23,DEPT OF DEFENSE,DEPT OF THE AIR FORCE,FA8207  AFNWC PZBC,541330,R425,,,UT,https://sam.gov/workspace/contract/opp/72c2896d9723492092adfb78393a010f/view,2026-07-15T12:31:17.044134+00:00
34f10f7db805450d97f8d1593b08f6b8,N0018926RB003Rev0001,"Re-issuance of canceled solicitation N0018926RB003, DUSN(M) ITD IT Related Services",Solicitation,2026-06-05,2026-06-16,2026-07-01,DEPT OF DEFENSE,DEPT OF THE NAVY,NAVSUP FLT LOG CTR NORFOLK,541330,DC01,No Set aside used,NONE,DC,https://sam.gov/workspace/contract/opp/34f10f7db805450d97f8d1593b08f6b8/view,2026-07-15T12:31:17.044134+00:00
7bb34e3d376e494488914f2db1a0a8bf,H9126926S3048,Joint Staff JROC and Functional Capability Support Services,Sources Sought,2026-06-11,2026-06-18,2026-07-03,DEPT OF DEFENSE,DEPT OF THE NAVY,NAVSUP FLT LOG CTR NORFOLK,541330,R425,,,DC,https://sam.gov/workspace/contract/opp/7bb34e3d376e494488914f2db1a0a8bf/view,2026-07-15T12:31:17.044134+00:00
029dc8e80e5b45399565647a78857a0f,N6133126R3101,N61331-26-R-3101 LCAC C4N and Cybersecurity Systems Program Support,Solicitation,2025-12-30,2026-01-30,2026-12-30,DEPT OF DEFENSE,DEPT OF THE NAVY,NAVAL SURFACE WARFARE CENTER,541330,R425,,,,https://sam.gov/workspace/contract/opp/029dc8e80e5b45399565647a78857a0f/view,2026-07-15T12:31:17.044134+00:00
8c2de41f79ce46d08f3606f76adc9099,SP4701-26-Q-0014,KnowItAll IR Spectral Library Subscription,Solicitation,2025-11-13,2026-11-14,2026-11-29,DEPT OF DEFENSE,DEFENSE LOGISTICS AGENCY,DCSO PHILADELPHIA,541519,7A21,No Set aside used,NONE,MI,https://sam.gov/workspace/contract/opp/8c2de41f79ce46d08f3606f76adc9099/view,2026-07-15T12:31:17.044134+00:00
918b81ea66ce468f84a0ede552983ce5,FA8650-25-R-TBD_FA8650-26-R-TBD,AFRL/DP Laboratory Demonstration Project,Sources Sought,2026-06-05,2026-06-22,2026-07-07,DEPT OF DEFENSE,DEPT OF THE AIR FORCE,FA2396 USAF AFMC AFRL PZL AFRL PZLE,541511,DA01,No Set aside used,NONE,OH,https://sam.gov/workspace/contract/opp/918b81ea66ce468f84a0ede552983ce5/view,2026-07-15T12:31:17.044134+00:00
a8262f4a2b724cf19b52682feedbefc2,W9127826RA043,USACE Mobile - Construction Management Services (CMS),Sources Sought,2026-02-05,2026-03-16,2027-02-05,DEPT OF DEFENSE,DEPT OF THE ARMY,W074 ENDIST MOBILE,541330,R499,,,,https://sam.gov/workspace/contract/opp/a8262f4a2b724cf19b52682feedbefc2/view,2026-07-15T12:31:17.044134+00:00
568436bece1e49888e047c21ecc39d29,W519TC-25-R-ADP2,Amendment 2 - PEO EIS ARDAP ARMY DATA PLATFORM 2.0 RFI,Presolicitation,2025-03-26,2024-10-16,2026-10-16,DEPT OF DEFENSE,DEPT OF THE ARMY,W6QK ACC-RI,541512,DA01,,,VA,https://sam.gov/workspace/contract/opp/568436bece1e49888e047c21ecc39d29/view,2026-07-15T12:31:17.044134+00:00
42a6ead37aec4de09fb9ce9a4c3151a5,PANSWD25P005872,"Notice of Intent to Sole Source - A-E Ambulatory Care Center, Phase 4",Special Notice,2025-11-20,2025-12-04,2026-11-14,DEPT OF DEFENSE,DEPT OF THE ARMY,W076 ENDIST FT WORTH,541330,C1BG,No Set aside used,NONE,TX,https://sam.gov/workspace/contract/opp/42a6ead37aec4de09fb9ce9a4c3151a5/view,2026-07-15T12:31:17.044134+00:00
7068ea19a03f4fdc9557635224ccdb54,PANDTA-26-P-0000RA-CE,Robotic and Autonomous Construction Equipment (RA-CE),Sources Sought,2026-06-29,2026-07-22,2026-08-06,DEPT OF DEFENSE,DEPT OF THE ARMY,W6QK ACC- DTA,541330,3895,,,MI,https://sam.gov/workspace/contract/opp/7068ea19a03f4fdc9557635224ccdb54/view,2026-07-15T12:31:17.044134+00:00
c2c6cd20253a42b5a57b9e76a23eb68d,N68936_NAWCWD_FY26_Industry_Day,NAWCWD FY26 Industry Day,Special Notice,2026-01-29,2027-01-30,2027-01-30,DEPT OF DEFENSE,DEPT OF THE NAVY,NAVAL AIR WARFARE CENTER,541330,R425,,,,https://sam.gov/workspace/contract/opp/c2c6cd20253a42b5a57b9e76a23eb68d/view,2026-07-15T12:31:17.044134+00:00
